{
  "schema": "workshop.bundle",
  "version": 1,
  "exportedAt": "2026-10-18T14:00:00.000Z",
  "source": {
    "mode": "browser",
    "backend": "browser"
  },
  "collections": [
    {
      "app": "prioritizer",
      "collection": "tasks",
      "envelope": {
        "schema": "prioritizer.tasks",
        "version": 3,
        "rev": 14,
        "updatedAt": "2026-10-18T13:02:11.000Z",
        "items": [
          {
            "id": "t_k2f9",
            "updatedAt": 1792328400000,
            "title": "Draft Q4 plan",
            "value": 3,
            "effort": "M",
            "done": false,
            "listId": "l_main"
          },
          {
            "id": "t_p81a",
            "updatedAt": 1792242000000,
            "title": "Review onboarding doc",
            "value": 2,
            "effort": "S",
            "done": true,
            "listId": "l_main"
          }
        ],
        "deleted": {
          "t_old1": 1792155600000
        },
        "meta": {
          "updatedAt": 1792328400000,
          "capacity": 20
        }
      }
    },
    {
      "app": "prioritizer",
      "collection": "lists",
      "envelope": {
        "schema": "prioritizer.lists",
        "version": 1,
        "rev": 3,
        "updatedAt": "2026-10-18T13:02:11.000Z",
        "items": [
          {
            "id": "l_main",
            "updatedAt": 1792000000000,
            "name": "Main",
            "parentId": null
          }
        ]
      }
    }
  ]
}
